title,authors,abstract,link,subjects
Toward Efficient Generalization in 3D Human Pose Estimation via a Canonical Domain Approach,"Hoosang Lee, Jeha Ryu","Abstract:Recent advancements in deep learning methods have significantly improved the performance of 3D Human Pose Estimation (HPE). However, performance degradation caused by domain gaps between source and target domains remains a major challenge to generalization, necessitating extensive data augmentation and/or fine-tuning for each specific target domain. To address this issue more efficiently, we propose a novel canonical domain approach that maps both the source and target domains into a unified canonical domain, alleviating the need for additional fine-tuning in the target domain. To construct the canonical domain, we introduce a canonicalization process to generate a novel canonical 2D-3D pose mapping that ensures 2D-3D pose consistency and simplifies 2D-3D pose patterns, enabling more efficient training of lifting networks. The canonicalization of both domains is achieved through the following steps: (1) in the source domain, the lifting network is trained within the canonical domain; (2) in the target domain, input 2D poses are canonicalized prior to inference by leveraging the properties of perspective projection and known camera intrinsics. Consequently, the trained network can be directly applied to the target domain without requiring additional fine-tuning. Experiments conducted with various lifting networks and publicly available datasets (e.g., Human3.6M, Fit3D, MPI-INF-3DHP) demonstrate that the proposed method substantially improves generalization capability across datasets while using the same data volume.",https://arxiv.org/abs/2501.16146,Computer Vision and Pattern Recognition (cs.CV); Artificial Intelligence (cs.AI)
Towards General-Purpose Model-Free Reinforcement Learning,"Scott Fujimoto, Pierluca D'Oro, Amy Zhang, Yuandong Tian, Michael Rabbat","Abstract:Reinforcement learning (RL) promises a framework for near-universal problem-solving. In practice however, RL algorithms are often tailored to specific benchmarks, relying on carefully tuned hyperparameters and algorithmic choices. Recently, powerful model-based RL methods have shown impressive general results across benchmarks but come at the cost of increased complexity and slow run times, limiting their broader applicability. In this paper, we attempt to find a unifying model-free deep RL algorithm that can address a diverse class of domains and problem settings. To achieve this, we leverage model-based representations that approximately linearize the value function, taking advantage of the denser task objectives used by model-based RL while avoiding the costs associated with planning or simulated trajectories. We evaluate our algorithm, MR.Q, on a variety of common RL benchmarks with a single set of hyperparameters and show a competitive performance against domain-specific and general baselines, providing a concrete step towards building general-purpose model-free deep RL algorithms.",https://arxiv.org/abs/2501.16142,Machine Learning (cs.LG); Artificial Intelligence (cs.AI)
Automated Detection of Sport Highlights from Audio and Video Sources,"Francesco Della Santa, Morgana Lalli","Abstract:This study presents a novel Deep Learning-based and lightweight approach for the automated detection of sports highlights (HLs) from audio and video sources. HL detection is a key task in sports video analysis, traditionally requiring significant human effort. Our solution leverages Deep Learning (DL) models trained on relatively small datasets of audio Mel-spectrograms and grayscale video frames, achieving promising accuracy rates of 89% and 83% for audio and video detection, respectively. The use of small datasets, combined with simple architectures, demonstrates the practicality of our method for fast and cost-effective deployment. Furthermore, an ensemble model combining both modalities shows improved robustness against false positives and false negatives. The proposed methodology offers a scalable solution for automated HL detection across various types of sports video content, reducing the need for manual intervention. Future work will focus on enhancing model architectures and extending this approach to broader scene-detection tasks in media analysis.",https://arxiv.org/abs/2501.16100,Computer Vision and Pattern Recognition (cs.CV); Artificial Intelligence (cs.AI); Machine Learning (cs.LG)
STAR: Stepwise Task Augmentation and Relation Learning for Aspect Sentiment Quad Prediction,"Wenna Lai, Haoran Xie, Guandong Xu, Qing Li","Abstract:Aspect-based sentiment analysis (ABSA) aims to identify four sentiment elements, including aspect term, aspect category, opinion term, and sentiment polarity. These elements construct the complete picture of sentiments. The most challenging task, aspect sentiment quad prediction (ASQP), predicts these elements simultaneously, hindered by difficulties in accurately coupling different sentiment elements. A key challenge is insufficient annotated data that limits the capability of models in semantic understanding and reasoning about quad prediction. To address this, we propose stepwise task augmentation and relation learning (STAR), a strategy inspired by human reasoning. STAR constructs auxiliary data to learn quadruple relationships incrementally by augmenting with pairwise and overall relation tasks derived from training data. By encouraging the model to infer causal relationships among sentiment elements without requiring additional annotations, STAR effectively enhances quad prediction. Extensive experiments demonstrate the proposed STAR exhibits superior performance on four benchmark datasets.",https://arxiv.org/abs/2501.16093,Computation and Language (cs.CL); Artificial Intelligence (cs.AI)
PISCO: Pretty Simple Compression for Retrieval-Augmented Generation,"Maxime Louis, Herv Djean, Stphane Clinchant","Abstract:Retrieval-Augmented Generation (RAG) pipelines enhance Large Language Models (LLMs) by retrieving relevant documents, but they face scalability issues due to high inference costs and limited context size. Document compression is a practical solution, but current soft compression methods suffer from accuracy losses and require extensive pretraining. In this paper, we introduce PISCO, a novel method that achieves a 16x compression rate with minimal accuracy loss (0-3%) across diverse RAG-based question-answering (QA) tasks. Unlike existing approaches, PISCO requires no pretraining or annotated data, relying solely on sequence-level knowledge distillation from document-based questions. With the ability to fine-tune a 7-10B LLM in 48 hours on a single A100 GPU, PISCO offers a highly efficient and scalable solution. We present comprehensive experiments showing that PISCO outperforms existing compression models by 8% in accuracy.",https://arxiv.org/abs/2501.16075,Computation and Language (cs.CL); Artificial Intelligence (cs.AI); Information Retrieval (cs.IR)
