title,authors,abstract,link,subjects
Abstraction Method for Generalized Planning with Baggable Types,"Hao Dong, Zheyuan Shi, Hemeng Zeng, Yongmei Liu","Abstract:Generalized planning is concerned with how to find a single plan to solve multiple similar planning instances. Abstractions are widely used for solving generalized planning, and QNP (qualitative numeric planning) is a popular abstract model. Recently, Cui et al. showed that a plan solves a sound and complete abstraction of a generalized planning problem if and only if the refined plan solves the original problem. However, existing work on automatic abstraction for generalized planning can hardly guarantee soundness let alone completeness. In this paper, we propose an automatic sound and complete abstraction method for generalized planning with baggable types. We use a variant of QNP, called bounded QNP (BQNP), where integer variables are increased or decreased by only one. Since BQNP is undecidable, we propose and implement a sound but incomplete solver for BQNP. We present an automatic method to abstract a BQNP problem from a classical planning instance with baggable types. The basic idea for abstraction is to introduce a counter for each bag of indistinguishable tuples of objects. We define a class of domains called proper baggable domains, and show that for such domains, the BQNP problem got by our automatic method is a sound and complete abstraction for a generalized planning problem whose instances share the same bags with the given instance but the sizes of the bags might be different. Thus, the refined plan of a solution to the BQNP problem is a solution to the generalized planning problem. Finally, we implement our abstraction method and experiments on a number of domains demonstrate the promise of our approach.",https://arxiv.org/abs/2501.15249,Artificial Intelligence (cs.AI)
A Causality-aware Paradigm for Evaluating Creativity of Multimodal Large Language Models,"Zhongzhan Huang, Shanshan Zhong, Pan Zhou, Shanghua Gao, Marinka Zitnik, Liang Lin","Abstract:Recently, numerous benchmarks have been developed to evaluate the logical reasoning abilities of large language models (LLMs). However, assessing the equally important creative capabilities of LLMs is challenging due to the subjective, diverse, and data-scarce nature of creativity, especially in multimodal scenarios. In this paper, we consider the comprehensive pipeline for evaluating the creativity of multimodal LLMs, with a focus on suitable evaluation platforms and methodologies. First, we find the Oogiri game, a creativity-driven task requiring humor, associative thinking, and the ability to produce unexpected responses to text, images, or both. This game aligns well with the input-output structure of modern multimodal LLMs and benefits from a rich repository of high-quality, human-annotated creative responses, making it an ideal platform for studying LLM creativity. Next, beyond using the Oogiri game for standard evaluations like ranking and selection, we propose LoTbench, an interactive, causality-aware evaluation framework, to further address some intrinsic risks in standard evaluations, such as information leakage and limited interpretability. The proposed LoTbench not only quantifies LLM creativity more effectively but also visualizes the underlying creative thought processes. Our results show that while most LLMs exhibit constrained creativity, the performance gap between LLMs and humans is not insurmountable. Furthermore, we observe a strong correlation between results from the multimodal cognition benchmark MMMU and LoTbench, but only a weak connection with traditional creativity metrics. This suggests that LoTbench better aligns with human cognitive theories, highlighting cognition as a critical foundation in the early stages of creativity and enabling the bridging of diverse concepts. this https URL",https://arxiv.org/abs/2501.15147,Artificial Intelligence (cs.AI); Human-Computer Interaction (cs.HC)
A New Approach for Knowledge Generation Using Active Inference,"Jamshid Ghasimi, Nazanin Movarraei","Abstract:There are various models proposed on how knowledge is generated in the human brain including the semantic networks model. Although this model has been widely studied and even computational models are presented, but, due to various limits and inefficiencies in the generation of different types of knowledge, its application is limited to semantic knowledge because of has been formed according to semantic memory and declarative knowledge and has many limits in explaining various procedural and conditional knowledge. Given the importance of providing an appropriate model for knowledge generation, especially in the areas of improving human cognitive functions or building intelligent machines, improving existing models in knowledge generation or providing more comprehensive models is of great importance. In the current study, based on the free energy principle of the brain, is the researchers proposed a model for generating three types of declarative, procedural, and conditional knowledge. While explaining different types of knowledge, this model is capable to compute and generate concepts from stimuli based on probabilistic mathematics and the action-perception process (active inference). The proposed model is unsupervised learning that can update itself using a combination of different stimuli as a generative model can generate new concepts of unsupervised received stimuli. In this model, the active inference process is used in the generation of procedural and conditional knowledge and the perception process is used to generate declarative knowledge.",https://arxiv.org/abs/2501.15105,Artificial Intelligence (cs.AI); Neurons and Cognition (q-bio.NC)
Data Center Cooling System Optimization Using Offline Reinforcement Learning,"Xianyuan Zhan, Xiangyu Zhu, Peng Cheng, Xiao Hu, Ziteng He, Hanfei Geng, Jichao Leng, Huiwen Zheng, Chenhui Liu, Tianshun Hong, Yan Liang, Yunxin Liu, Feng Zhao","Abstract:The recent advances in information technology and artificial intelligence have fueled a rapid expansion of the data center (DC) industry worldwide, accompanied by an immense appetite for electricity to power the DCs. In a typical DC, around 30~40% of the energy is spent on the cooling system rather than on computer servers, posing a pressing need for developing new energy-saving optimization technologies for DC cooling systems. However, optimizing such real-world industrial systems faces numerous challenges, including but not limited to a lack of reliable simulation environments, limited historical data, and stringent safety and control robustness requirements. In this work, we present a novel physics-informed offline reinforcement learning (RL) framework for energy efficiency optimization of DC cooling systems. The proposed framework models the complex dynamical patterns and physical dependencies inside a server room using a purposely designed graph neural network architecture that is compliant with the fundamental time-reversal symmetry. Because of its well-behaved and generalizable state-action representations, the model enables sample-efficient and robust latent space offline policy learning using limited real-world operational data. Our framework has been successfully deployed and verified in a large-scale production DC for closed-loop control of its air-cooling units (ACUs). We conducted a total of 2000 hours of short and long-term experiments in the production DC environment. The results show that our method achieves 14~21% energy savings in the DC cooling system, without any violation of the safety or operational constraints. Our results have demonstrated the significant potential of offline RL in solving a broad range of data-limited, safety-critical real-world industrial control problems.",https://arxiv.org/abs/2501.15085,Artificial Intelligence (cs.AI); Machine Learning (cs.LG); Systems and Control (eess.SY)
Feedback-Aware Monte Carlo Tree Search for Efficient Information Seeking in Goal-Oriented Conversations,"Harshita Chopra, Chirag Shah","Abstract:The ability to identify and acquire missing information is a critical component of effective decision making and problem solving. With the rise of conversational artificial intelligence (AI) systems, strategically formulating information-seeking questions becomes crucial and demands efficient methods to guide the search process. We introduce a novel approach to adaptive question-asking through a combination of Large Language Models (LLM) for generating questions that maximize information gain, Monte Carlo Tree Search (MCTS) for constructing and leveraging a decision tree across multiple samples, and a hierarchical feedback mechanism to learn from past interactions. We present two key innovations: (1) an adaptive MCTS algorithm that balances exploration and exploitation for efficient search over potential questions; and (2) a clustering-based feedback algorithm that leverages prior experience to guide future interactions. Each incoming sample is assigned to a cluster based on its semantic similarity with previously observed samples. Our UCT (Upper Confidence bound for Trees) formulation selects optimal questions by combining expected rewards, a function of information gain, with a cluster-specific bonus that decays with depth, to emphasize the importance of early-stage questions that have proven effective for narrowing the solution space in similar samples. Experiments across three domains, including medical diagnosis and troubleshooting, demonstrate that our method leads to an average of 12% improvement in success rates and a 10x reduction in the average number of LLM calls made per conversation for the search process, in comparison to the state of the art.",https://arxiv.org/abs/2501.15056,Artificial Intelligence (cs.AI); Computation and Language (cs.CL); Human-Computer Interaction (cs.HC); Machine Learning (cs.LG)
Controllable Protein Sequence Generation with LLM Preference Optimization,"Xiangyu Liu, Yi Liu, Silei Chen, Wei Hu","Abstract:Designing proteins with specific attributes offers an important solution to address biomedical challenges. Pre-trained protein large language models (LLMs) have shown promising results on protein sequence generation. However, to control sequence generation for specific attributes, existing work still exhibits poor functionality and structural stability. In this paper, we propose a novel controllable protein design method called CtrlProt. We finetune a protein LLM with a new multi-listwise preference optimization strategy to improve generation quality and support multi-attribute controllable generation. Experiments demonstrate that CtrlProt can meet functionality and structural stability requirements effectively, achieving state-of-the-art performance in both single-attribute and multi-attribute protein sequence generation.",https://arxiv.org/abs/2501.15007,"Artificial Intelligence (cs.AI); Computational Engineering, Finance, and Science (cs.CE); Quantitative Methods (q-bio.QM)"
What if Eye...? Computationally Recreating Vision Evolution,"Kushagra Tiwary, Aaron Young, Zaid Tasneem, Tzofi Klinghoffer, Akshat Dave, Tomaso Poggio, Dan Nilsson, Brian Cheung, Ramesh Raskar","Abstract:Vision systems in nature show remarkable diversity, from simple light-sensitive patches to complex camera eyes with lenses. While natural selection has produced these eyes through countless mutations over millions of years, they represent just one set of realized evolutionary paths. Testing hypotheses about how environmental pressures shaped eye evolution remains challenging since we cannot experimentally isolate individual factors. Computational evolution offers a way to systematically explore alternative trajectories. Here we show how environmental demands drive three fundamental aspects of visual evolution through an artificial evolution framework that co-evolves both physical eye structure and neural processing in embodied agents. First, we demonstrate computational evidence that task specific selection drives bifurcation in eye evolution - orientation tasks like navigation in a maze leads to distributed compound-type eyes while an object discrimination task leads to the emergence of high-acuity camera-type eyes. Second, we reveal how optical innovations like lenses naturally emerge to resolve fundamental tradeoffs between light collection and spatial precision. Third, we uncover systematic scaling laws between visual acuity and neural processing, showing how task complexity drives coordinated evolution of sensory and computational capabilities. Our work introduces a novel paradigm that illuminates evolutionary principles shaping vision by creating targeted single-player games where embodied agents must simultaneously evolve visual systems and learn complex behaviors. Through our unified genetic encoding framework, these embodied agents serve as next-generation hypothesis testing machines while providing a foundation for designing manufacturable bio-inspired vision systems.",https://arxiv.org/abs/2501.15001,Artificial Intelligence (cs.AI); Computer Vision and Pattern Recognition (cs.CV); Neural and Evolutionary Computing (cs.NE); Neurons and Cognition (q-bio.NC)
MISCON: A Mission-Driven Conversational Consultant for Pre-Venture Entrepreneurs in Food Deserts,"Subhasis Dasgupta, Hans Taparia, Laura Schmidt, Amarnath Gupta","Abstract:This work-in-progress report describes MISCON, a conversational consultant being developed for a public mission project called NOURISH. With MISCON, aspiring small business owners in a food-insecure region and their advisors in Community-based organizations would be able to get information, recommendation and analysis regarding setting up food businesses. MISCON conversations are modeled as state machine that uses a heterogeneous knowledge graph as well as several analytical tools and services including a variety of LLMs. In this short report, we present the functional architecture and some design considerations behind MISCON.",https://arxiv.org/abs/2501.14954,Artificial Intelligence (cs.AI); Computation and Language (cs.CL); Information Retrieval (cs.IR)
Causal Graphs Meet Thoughts: Enhancing Complex Reasoning in Graph-Augmented LLMs,"Hang Luo, Jian Zhang, Chujun Li","Abstract:In knowledge-intensive tasks, especially in high-stakes domains like medicine and law, it is critical not only to retrieve relevant information but also to provide causal reasoning and explainability. Large language models (LLMs) have achieved remarkable performance in natural language understanding and generation tasks. However, they often suffer from limitations such as difficulty in incorporating new knowledge, generating hallucinations, and explaining their reasoning process. To address these challenges, integrating knowledge graphs with Graph Retrieval-Augmented Generation (Graph RAG) has emerged as an effective solution. Traditional Graph RAG methods often rely on simple graph traversal or semantic similarity, which do not capture causal relationships or align well with the model's internal reasoning steps. This paper proposes a novel pipeline that filters large knowledge graphs to emphasize cause-effect edges, aligns the retrieval process with the model's chain-of-thought (CoT), and enhances reasoning through multi-stage path improvements. Experiments on medical question-answering tasks show consistent gains, with up to a 10\% absolute improvement across multiple large language models (LLMs). This approach demonstrates the value of combining causal reasoning with stepwise retrieval, leading to more interpretable and logically grounded solutions for complex queries.",https://arxiv.org/abs/2501.14892,Artificial Intelligence (cs.AI); Computation and Language (cs.CL)
Symbolic Knowledge Extraction and Injection with Sub-symbolic Predictors: A Systematic Literature Review,"Giovanni Ciatto, Federico Sabbatini, Andrea Agiollo, Matteo Magnini, Andrea Omicini","Abstract:In this paper we focus on the opacity issue of sub-symbolic machine learning predictors by promoting two complementary activities, namely, symbolic knowledge extraction (SKE) and injection (SKI) from and into sub-symbolic predictors. We consider as symbolic any language being intelligible and interpretable for both humans and computers. Accordingly, we propose general meta-models for both SKE and SKI, along with two taxonomies for the classification of SKE and SKI methods. By adopting an explainable artificial intelligence (XAI) perspective, we highlight how such methods can be exploited to mitigate the aforementioned opacity issue. Our taxonomies are attained by surveying and classifying existing methods from the literature, following a systematic approach, and by generalising the results of previous surveys targeting specific sub-topics of either SKE or SKI alone. More precisely, we analyse 132 methods for SKE and 117 methods for SKI, and we categorise them according to their purpose, operation, expected input/output data and predictor types. For each method, we also indicate the presence/lack of runnable software implementations. Our work may be of interest for data scientists aiming at selecting the most adequate SKE/SKI method for their needs, and also work as suggestions for researchers interested in filling the gaps of the current state of the art, as well as for developers willing to implement SKE/SKI-based technologies.",https://arxiv.org/abs/2501.14836,Artificial Intelligence (cs.AI); Machine Learning (cs.LG); Logic in Computer Science (cs.LO)
RelightVid: Temporal-Consistent Diffusion Model for Video Relighting,"Ye Fang, Zeyi Sun, Shangzhan Zhang, Tong Wu, Yinghao Xu, Pan Zhang, Jiaqi Wang, Gordon Wetzstein, Dahua Lin","Abstract:Diffusion models have demonstrated remarkable success in image generation and editing, with recent advancements enabling albedo-preserving image relighting. However, applying these models to video relighting remains challenging due to the lack of paired video relighting datasets and the high demands for output fidelity and temporal consistency, further complicated by the inherent randomness of diffusion models. To address these challenges, we introduce RelightVid, a flexible framework for video relighting that can accept background video, text prompts, or environment maps as relighting conditions. Trained on in-the-wild videos with carefully designed illumination augmentations and rendered videos under extreme dynamic lighting, RelightVid achieves arbitrary video relighting with high temporal consistency without intrinsic decomposition while preserving the illumination priors of its image backbone.",https://arxiv.org/abs/2501.16330,Computer Vision and Pattern Recognition (cs.CV); Artificial Intelligence (cs.AI)
sDREAMER: Self-distilled Mixture-of-Modality-Experts Transformer for Automatic Sleep Staging,"Jingyuan Chen, Yuan Yao, Mie Anderson, Natalie Hauglund, Celia Kjaerby, Verena Untiet, Maiken Nedergaard, Jiebo Luo","Abstract:Automatic sleep staging based on electroencephalography (EEG) and electromyography (EMG) signals is an important aspect of sleep-related research. Current sleep staging methods suffer from two major drawbacks. First, there are limited information interactions between modalities in the existing methods. Second, current methods do not develop unified models that can handle different sources of input. To address these issues, we propose a novel sleep stage scoring model sDREAMER, which emphasizes cross-modality interaction and per-channel performance. Specifically, we develop a mixture-of-modality-expert (MoME) model with three pathways for EEG, EMG, and mixed signals with partially shared weights. We further propose a self-distillation training scheme for further information interaction across modalities. Our model is trained with multi-channel inputs and can make classifications on either single-channel or multi-channel inputs. Experiments demonstrate that our model outperforms the existing transformer-based sleep scoring methods for multi-channel inference. For single-channel inference, our model also outperforms the transformer-based models trained with single-channel signals.",https://arxiv.org/abs/2501.16329,Machine Learning (cs.LG); Artificial Intelligence (cs.AI)
Evaluating The Performance of Using Large Language Models to Automate Summarization of CT Simulation Orders in Radiation Oncology,"Meiyun Cao, Shaw Hu, Jason Sharp, Edward Clouser, Jason Holmes, Linda L. Lam, Xiaoning Ding, Diego Santos Toesca, Wendy S. Lindholm, Samir H. Patel, Sujay A. Vora, Peilong Wang, Wei Liu","Abstract:Purpose: This study aims to use a large language model (LLM) to automate the generation of summaries from the CT simulation orders and evaluate its performance.
Materials and Methods: A total of 607 CT simulation orders for patients were collected from the Aria database at our institution. A locally hosted Llama 3.1 405B model, accessed via the Application Programming Interface (API) service, was used to extract keywords from the CT simulation orders and generate summaries. The downloaded CT simulation orders were categorized into seven groups based on treatment modalities and disease sites. For each group, a customized instruction prompt was developed collaboratively with therapists to guide the Llama 3.1 405B model in generating summaries. The ground truth for the corresponding summaries was manually derived by carefully reviewing each CT simulation order and subsequently verified by therapists. The accuracy of the LLM-generated summaries was evaluated by therapists using the verified ground truth as a reference.
Results: About 98% of the LLM-generated summaries aligned with the manually generated ground truth in terms of accuracy. Our evaluations showed an improved consistency in format and enhanced readability of the LLM-generated summaries compared to the corresponding therapists-generated summaries. This automated approach demonstrated a consistent performance across all groups, regardless of modality or disease site.
Conclusions: This study demonstrated the high precision and consistency of the Llama 3.1 405B model in extracting keywords and summarizing CT simulation orders, suggesting that LLMs have great potential to help with this task, reduce the workload of therapists and improve workflow efficiency.",https://arxiv.org/abs/2501.16309,Medical Physics (physics.med-ph); Artificial Intelligence (cs.AI)
Large Models in Dialogue for Active Perception and Anomaly Detection,"Tzoulio Chamiti, Nikolaos Passalis, Anastasios Tefas","Abstract:Autonomous aerial monitoring is an important task aimed at gathering information from areas that may not be easily accessible by humans. At the same time, this task often requires recognizing anomalies from a significant distance or not previously encountered in the past. In this paper, we propose a novel framework that leverages the advanced capabilities provided by Large Language Models (LLMs) to actively collect information and perform anomaly detection in novel scenes. To this end, we propose an LLM based model dialogue approach, in which two deep learning models engage in a dialogue to actively control a drone to increase perception and anomaly detection accuracy. We conduct our experiments in a high fidelity simulation environment where an LLM is provided with a predetermined set of natural language movement commands mapped into executable code functions. Additionally, we deploy a multimodal Visual Question Answering (VQA) model charged with the task of visual question answering and captioning. By engaging the two models in conversation, the LLM asks exploratory questions while simultaneously flying a drone into different parts of the scene, providing a novel way to implement active perception. By leveraging LLMs reasoning ability, we output an improved detailed description of the scene going beyond existing static perception approaches. In addition to information gathering, our approach is utilized for anomaly detection and our results demonstrate the proposed methods effectiveness in informing and alerting about potential hazards.",https://arxiv.org/abs/2501.16300,Computer Vision and Pattern Recognition (cs.CV); Artificial Intelligence (cs.AI)
