title,authors,abstract,link,subjects
Mixture-of-Mamba: Enhancing Multi-Modal State-Space Models with Modality-Aware Sparsity,"Weixin Liang, Junhong Shen, Genghan Zhang, Ning Dong, Luke Zettlemoyer, Lili Yu","Abstract:State Space Models (SSMs) have emerged as efficient alternatives to Transformers for sequential modeling, but their inability to leverage modality-specific features limits their performance in multi-modal pretraining. Here, we propose Mixture-of-Mamba, a novel SSM architecture that introduces modality-aware sparsity through modality-specific parameterization of the Mamba block. Building on Mixture-of-Transformers (W. Liang et al. arXiv:2411.04996; 2024), we extend the benefits of modality-aware sparsity to SSMs while preserving their computational efficiency. We evaluate Mixture-of-Mamba across three multi-modal pretraining settings: Transfusion (interleaved text and continuous image tokens with diffusion loss), Chameleon (interleaved text and discrete image tokens), and an extended three-modality framework incorporating speech. Mixture-of-Mamba consistently reaches the same loss values at earlier training steps with significantly reduced computational costs. In the Transfusion setting, Mixture-of-Mamba achieves equivalent image loss using only 34.76% of the training FLOPs at the 1.4B scale. In the Chameleon setting, Mixture-of-Mamba reaches similar image loss with just 42.50% of the FLOPs at the 1.4B scale, and similar text loss with just 65.40% of the FLOPs. In the three-modality setting, MoM matches speech loss at 24.80% of the FLOPs at the 1.4B scale. Our ablation study highlights the synergistic effects of decoupling projection components, where joint decoupling yields greater gains than individual modifications. These results establish modality-aware sparsity as a versatile and effective design principle, extending its impact from Transformers to SSMs and setting new benchmarks in multi-modal pretraining. Our code can be accessed at this https URL",https://arxiv.org/abs/2501.16295,Machine Learning (cs.LG); Artificial Intelligence (cs.AI); Computation and Language (cs.CL); Computer Vision and Pattern Recognition (cs.CV)
Upside Down Reinforcement Learning with Policy Generators,"Jacopo Di Ventura, Dylan R. Ashley, Francesco Faccio, Vincent Herrmann, Jrgen Schmidhuber","Abstract:Upside Down Reinforcement Learning (UDRL) is a promising framework for solving reinforcement learning problems which focuses on learning command-conditioned policies. In this work, we extend UDRL to the task of learning a command-conditioned generator of deep neural network policies. We accomplish this using Hypernetworks - a variant of Fast Weight Programmers, which learn to decode input commands representing a desired expected return into command-specific weight matrices. Our method, dubbed Upside Down Reinforcement Learning with Policy Generators (UDRLPG), streamlines comparable techniques by removing the need for an evaluator or critic to update the weights of the generator. To counteract the increased variance in last returns caused by not having an evaluator, we decouple the sampling probability of the buffer from the absolute number of policies in it, which, together with a simple weighting strategy, improves the empirical convergence of the algorithm. Compared with existing algorithms, UDRLPG achieves competitive performance and high returns, sometimes outperforming more complex architectures. Our experiments show that a trained generator can generalize to create policies that achieve unseen returns zero-shot. The proposed method appears to be effective in mitigating some of the challenges associated with learning highly multimodal functions. Altogether, we believe that UDRLPG represents a promising step forward in achieving greater empirical sample efficiency in RL. A full implementation of UDRLPG is publicly available at this https URL",https://arxiv.org/abs/2501.16288,Machine Learning (cs.LG); Artificial Intelligence (cs.AI)
Brain-Adapter: Enhancing Neurological Disorder Analysis with Adapter-Tuning Multimodal Large Language Models,"Jing Zhang, Xiaowei Yu, Yanjun Lyu, Lu Zhang, Tong Chen, Chao Cao, Yan Zhuang, Minheng Chen, Tianming Liu, Dajiang Zhu","Abstract:Understanding brain disorders is crucial for accurate clinical diagnosis and treatment. Recent advances in Multimodal Large Language Models (MLLMs) offer a promising approach to interpreting medical images with the support of text descriptions. However, previous research has primarily focused on 2D medical images, leaving richer spatial information of 3D images under-explored, and single-modality-based methods are limited by overlooking the critical clinical information contained in other modalities. To address this issue, this paper proposes Brain-Adapter, a novel approach that incorporates an extra bottleneck layer to learn new knowledge and instill it into the original pre-trained knowledge. The major idea is to incorporate a lightweight bottleneck layer to train fewer parameters while capturing essential information and utilize a Contrastive Language-Image Pre-training (CLIP) strategy to align multimodal data within a unified representation space. Extensive experiments demonstrated the effectiveness of our approach in integrating multimodal data to significantly improve the diagnosis accuracy without high computational costs, highlighting the potential to enhance real-world diagnostic workflows.",https://arxiv.org/abs/2501.16282,Image and Video Processing (eess.IV); Artificial Intelligence (cs.AI); Computer Vision and Pattern Recognition (cs.CV)
What is Formal Verification without Specifications? A Survey on mining LTL Specifications,"Daniel Neider, Rajarshi Roy","Abstract:Virtually all verification techniques using formal methods rely on the availability of a formal specification, which describes the design requirements precisely. However, formulating specifications remains a manual task that is notoriously challenging and error-prone. To address this bottleneck in formal verification, recent research has thus focussed on automatically generating specifications for formal verification from examples of (desired and undesired) system behavior. In this survey, we list and compare recent advances in mining specifications in Linear Temporal Logic (LTL), the de facto standard specification language for reactive systems. Several approaches have been designed for learning LTL formulas, which address different aspects and settings of specification design. Moreover, the approaches rely on a diverse range of techniques such as constraint solving, neural network training, enumerative search, etc. We survey the current state-of-the-art techniques and compare them for the convenience of the formal methods practitioners.",https://arxiv.org/abs/2501.16274,Formal Languages and Automata Theory (cs.FL); Artificial Intelligence (cs.AI); Logic in Computer Science (cs.LO)
Return of the Encoder: Maximizing Parameter Efficiency for SLMs,"Mohamed Elfeki, Rui Liu, Chad Voegele","Abstract:The dominance of large decoder-only language models has overshadowed encoder-decoder architectures, despite their fundamental efficiency advantages in sequence processing. For small language models (SLMs) - those with 1 billion parameters or fewer - our systematic analysis across GPU, CPU, and NPU platforms reveals that encoder-decoder architectures achieve 47% lower first-token latency and 4.7x higher throughput compared to decoder-only models on edge devices. These gains may be attributed to encoder-decoder's one-time input processing and efficient separation of understanding and generation phases.
We introduce a novel knowledge distillation framework that enables encoder-decoder models to leverage capabilities from large scalable decoder-only teachers while preserving their architectural advantages, achieving up to 6 average performance points improvement across diverse tasks, with significant gains in asymmetric sequence tasks where input and output distributions can benefit from different processing approaches.
When combined with modern advances like Rotary Positional Embeddings (RoPE) and Vision encoders, our systematic investigation demonstrates that encoder-decoder architectures provide a more practical path toward deploying capable language models in resource-constrained environments. Our findings challenge the prevailing trend toward decoder-only scaling, showing that architectural choices become increasingly crucial as parameter budgets decrease, particularly for on-device and edge deployments where computational efficiency is paramount.",https://arxiv.org/abs/2501.16273,Computation and Language (cs.CL); Artificial Intelligence (cs.AI); Computer Vision and Pattern Recognition (cs.CV)
From Molecules to Mixtures: Learning Representations of Olfactory Mixture Similarity using Inductive Biases,"Gary Tom, Cher Tian Ser, Ella M. Rajaonson, Stanley Lo, Hyun Suk Park, Brian K. Lee, Benjamin Sanchez-Lengeling","Abstract:Olfaction -- how molecules are perceived as odors to humans -- remains poorly understood. Recently, the principal odor map (POM) was introduced to digitize the olfactory properties of single compounds. However, smells in real life are not pure single molecules, but complex mixtures of molecules, whose representations remain relatively under-explored. In this work, we introduce POMMix, an extension of the POM to represent mixtures. Our representation builds upon the symmetries of the problem space in a hierarchical manner: (1) graph neural networks for building molecular embeddings, (2) attention mechanisms for aggregating molecular representations into mixture representations, and (3) cosine prediction heads to encode olfactory perceptual distance in the mixture embedding space. POMMix achieves state-of-the-art predictive performance across multiple datasets. We also evaluate the generalizability of the representation on multiple splits when applied to unseen molecules and mixture sizes. Our work advances the effort to digitize olfaction, and highlights the synergy of domain expertise and deep learning in crafting expressive representations in low-data regimes.",https://arxiv.org/abs/2501.16271,Machine Learning (cs.LG); Artificial Intelligence (cs.AI)
Lightweight Weighted Average Ensemble Model for Pneumonia Detection in Chest X-Ray Images,"Suresh Babu Nettur, Shanthi Karpurapu, Unnati Nettur, Likhit Sagar Gajja, Sravanthy Myneni, Akhil Dusi, Lalithya Posham","Abstract:Pneumonia is a leading cause of illness and death in children, underscoring the need for early and accurate detection. In this study, we propose a novel lightweight ensemble model for detecting pneumonia in children using chest X-ray images. This ensemble model integrates two pre-trained convolutional neural networks (CNNs), MobileNetV2 and NASNetMobile, selected for their balance of computational efficiency and accuracy. These models were fine-tuned on a pediatric chest X-ray dataset and combined to enhance classification performance. Our proposed ensemble model achieved a classification accuracy of 98.63%, significantly outperforming individual models such as MobileNetV2 (97.10%) and NASNetMobile(96.25%) in terms of accuracy, precision, recall, and F1 score. Moreover, the ensemble model outperformed state-of-the-art architectures, including ResNet50, InceptionV3, and DenseNet201, while maintaining computational efficiency. The proposed lightweight ensemble model presents a highly effective and resource-efficient solution for pneumonia detection, making it particularly suitable for deployment in resource-constrained settings.",https://arxiv.org/abs/2501.16249,Image and Video Processing (eess.IV); Artificial Intelligence (cs.AI); Computer Vision and Pattern Recognition (cs.CV)
Accelerating Quantum Reinforcement Learning with a Quantum Natural Policy Gradient Based Approach,"Yang Xu, Vaneet Aggarwal","Abstract:We address the problem of quantum reinforcement learning (QRL) under model-free settings with quantum oracle access to the Markov Decision Process (MDP). This paper introduces a Quantum Natural Policy Gradient (QNPG) algorithm, which replaces the random sampling used in classical Natural Policy Gradient (NPG) estimators with a deterministic gradient estimation approach, enabling seamless integration into quantum systems. While this modification introduces a bounded bias in the estimator, the bias decays exponentially with increasing truncation levels. This paper demonstrates that the proposed QNPG algorithm achieves a sample complexity of $\tilde{\mathcal{O}}(\epsilon^{-1.5})$ for queries to the quantum oracle, significantly improving the classical lower bound of $\tilde{\mathcal{O}}(\epsilon^{-2})$ for queries to the MDP.",https://arxiv.org/abs/2501.16243,Quantum Physics (quant-ph); Artificial Intelligence (cs.AI); Machine Learning (stat.ML)
Language-Based Bayesian Optimization Research Assistant (BORA),"Abdoulatif Ciss, Xenophon Evangelopoulos, Vladimir V. Gusev, Andrew I. Cooper","Abstract:Many important scientific problems involve multivariate optimization coupled with slow and laborious experimental measurements. These complex, high-dimensional searches can be defined by non-convex optimization landscapes that resemble needle-in-a-haystack surfaces, leading to entrapment in local minima. Contextualizing optimizers with human domain knowledge is a powerful approach to guide searches to localized fruitful regions. However, this approach is susceptible to human confirmation bias and it is also challenging for domain experts to keep track of the rapidly expanding scientific literature. Here, we propose the use of Large Language Models (LLMs) for contextualizing Bayesian optimization (BO) via a hybrid optimization framework that intelligently and economically blends stochastic inference with domain knowledge-based insights from the LLM, which is used to suggest new, better-performing areas of the search space for exploration. Our method fosters user engagement by offering real-time commentary on the optimization progress, explaining the reasoning behind the search strategies. We validate the effectiveness of our approach on synthetic benchmarks with up to 15 independent variables and demonstrate the ability of LLMs to reason in four real-world experimental tasks where context-aware suggestions boost optimization performance substantially.",https://arxiv.org/abs/2501.16224,Machine Learning (cs.LG); Artificial Intelligence (cs.AI)
UDBE: Unsupervised Diffusion-based Brightness Enhancement in Underwater Images,"Tatiana Tas Schein, Gustavo Pereira de Almeira, Stephanie Loi Brio, Rodrigo Andrade de Bem, Felipe Gomes de Oliveira, Paulo L. J. Drews-Jr","Abstract:Activities in underwater environments are paramount in several scenarios, which drives the continuous development of underwater image enhancement techniques. A major challenge in this domain is the depth at which images are captured, with increasing depth resulting in a darker environment. Most existing methods for underwater image enhancement focus on noise removal and color adjustment, with few works dedicated to brightness enhancement. This work introduces a novel unsupervised learning approach to underwater image enhancement using a diffusion model. Our method, called UDBE, is based on conditional diffusion to maintain the brightness details of the unpaired input images. The input image is combined with a color map and a Signal-Noise Relation map (SNR) to ensure stable training and prevent color distortion in the output images. The results demonstrate that our approach achieves an impressive accuracy rate in the datasets UIEB, SUIM and RUIE, well-established underwater image benchmarks. Additionally, the experiments validate the robustness of our approach, regarding the image quality metrics PSNR, SSIM, UIQM, and UISM, indicating the good performance of the brightness enhancement process. The source code is available here: this https URL.",https://arxiv.org/abs/2501.16211,Computer Vision and Pattern Recognition (cs.CV); Artificial Intelligence (cs.AI); Image and Video Processing (eess.IV)
Raiders of the Lost Dependency: Fixing Dependency Conflicts in Python using LLMs,"Antony Bartlett, Cynthia Liem, Annibale Panichella","Abstract:Fixing Python dependency issues is a tedious and error-prone task for developers, who must manually identify and resolve environment dependencies and version constraints of third-party modules and Python interpreters. Researchers have attempted to automate this process by relying on large knowledge graphs and database lookup tables. However, these traditional approaches face limitations due to the variety of dependency error types, large sets of possible module versions, and conflicts among transitive dependencies. This study explores the potential of using large language models (LLMs) to automatically fix dependency issues in Python programs. We introduce PLLM (pronounced ""plum""), a novel technique that employs retrieval-augmented generation (RAG) to help an LLM infer Python versions and required modules for a given Python file. PLLM builds a testing environment that iteratively (1) prompts the LLM for module combinations, (2) tests the suggested changes, and (3) provides feedback (error messages) to the LLM to refine the fix. This feedback cycle leverages natural language processing (NLP) to intelligently parse and interpret build error messages. We benchmark PLLM on the Gistable HG2.9K dataset, a collection of challenging single-file Python gists. We compare PLLM against two state-of-the-art automatic dependency inference approaches, namely PyEGo and ReadPyE, w.r.t. the ability to resolve dependency issues. Our results indicate that PLLM can fix more dependency issues than the two baselines, with +218 (+15.97%) more fixes over ReadPyE and +281 (+21.58%) over PyEGo. Our deeper analyses suggest that PLLM is particularly beneficial for projects with many dependencies and for specific third-party numerical and machine-learning modules. Our findings demonstrate the potential of LLM-based approaches to iteratively resolve Python dependency issues.",https://arxiv.org/abs/2501.16191,Software Engineering (cs.SE); Artificial Intelligence (cs.AI)
The Linear Attention Resurrection in Vision Transformer,Chuanyang Zheng,"Abstract:Vision Transformers (ViTs) have recently taken computer vision by storm. However, the softmax attention underlying ViTs comes with a quadratic complexity in time and memory, hindering the application of ViTs to high-resolution images. We revisit the attention design and propose a linear attention method to address the limitation, which doesn't sacrifice ViT's core advantage of capturing global representation like existing methods (e.g. local window attention of Swin). We further investigate the key difference between linear attention and softmax attention. Our empirical results suggest that linear attention lacks a fundamental property of concentrating the distribution of the attention matrix. Inspired by this observation, we introduce a local concentration module to enhance linear attention. By incorporating enhanced linear global attention and local window attention, we propose a new ViT architecture, dubbed L$^2$ViT. Notably, L$^2$ViT can effectively capture both global interactions and local representations while enjoying linear computational complexity. Extensive experiments demonstrate the strong performance of L$^2$ViT. On image classification, L$^2$ViT achieves 84.4% Top-1 accuracy on ImageNet-1K without any extra training data or label. By further pre-training on ImageNet-22k, it attains 87.0% when fine-tuned with resolution 384$^2$. For downstream tasks, L$^2$ViT delivers favorable performance as a backbone on object detection as well as semantic segmentation.",https://arxiv.org/abs/2501.16182,Computer Vision and Pattern Recognition (cs.CV); Artificial Intelligence (cs.AI)
BAG: Body-Aligned 3D Wearable Asset Generation,"Zhongjin Luo, Yang Li, Mingrui Zhang, Senbo Wang, Han Yan, Xibin Song, Taizhang Shang, Wei Mao, Hongdong Li, Xiaoguang Han, Pan Ji","Abstract:While recent advancements have shown remarkable progress in general 3D shape generation models, the challenge of leveraging these approaches to automatically generate wearable 3D assets remains unexplored. To this end, we present BAG, a Body-aligned Asset Generation method to output 3D wearable asset that can be automatically dressed on given 3D human bodies. This is achived by controlling the 3D generation process using human body shape and pose information. Specifically, we first build a general single-image to consistent multiview image diffusion model, and train it on the large Objaverse dataset to achieve diversity and generalizability. Then we train a Controlnet to guide the multiview generator to produce body-aligned multiview images. The control signal utilizes the multiview 2D projections of the target human body, where pixel values represent the XYZ coordinates of the body surface in a canonical space. The body-conditioned multiview diffusion generates body-aligned multiview images, which are then fed into a native 3D diffusion model to produce the 3D shape of the asset. Finally, by recovering the similarity transformation using multiview silhouette supervision and addressing asset-body penetration with physics simulators, the 3D asset can be accurately fitted onto the target human body. Experimental results demonstrate significant advantages over existing methods in terms of image prompt-following capability, shape diversity, and shape quality. Our project page is available at this https URL.",https://arxiv.org/abs/2501.16177,Computer Vision and Pattern Recognition (cs.CV); Artificial Intelligence (cs.AI); Graphics (cs.GR)
Measuring Heterogeneity in Machine Learning with Distributed Energy Distance,"Mengchen Fan, Baocheng Geng, Roman Shterenberg, Joseph A. Casey, Zhong Chen, Keren Li","Abstract:In distributed and federated learning, heterogeneity across data sources remains a major obstacle to effective model aggregation and convergence. We focus on feature heterogeneity and introduce energy distance as a sensitive measure for quantifying distributional discrepancies. While we show that energy distance is robust for detecting data distribution shifts, its direct use in large-scale systems can be prohibitively expensive. To address this, we develop Taylor approximations that preserve key theoretical quantitative properties while reducing computational overhead. Through simulation studies, we show how accurately capturing feature discrepancies boosts convergence in distributed learning. Finally, we propose a novel application of energy distance to assign penalty weights for aligning predictions across heterogeneous nodes, ultimately enhancing coordination in federated and distributed settings.",https://arxiv.org/abs/2501.16174,"Machine Learning (stat.ML); Artificial Intelligence (cs.AI); Distributed, Parallel, and Cluster Computing (cs.DC); Machine Learning (cs.LG)"
MetaDecorator: Generating Immersive Virtual Tours through Multimodality,"Shuang Xie, Yang Liu, Jeannie S.A. Lee, Haiwei Dong","Abstract:MetaDecorator, is a framework that empowers users to personalize virtual spaces. By leveraging text-driven prompts and image synthesis techniques, MetaDecorator adorns static panoramas captured by 360 imaging devices, transforming them into uniquely styled and visually appealing environments. This significantly enhances the realism and engagement of virtual tours compared to traditional offerings. Beyond the core framework, we also discuss the integration of Large Language Models (LLMs) and haptics in the VR application to provide a more immersive experience.",https://arxiv.org/abs/2501.16164,Human-Computer Interaction (cs.HC); Artificial Intelligence (cs.AI); Emerging Technologies (cs.ET); Multimedia (cs.MM)
AdaCoT: Rethinking Cross-Lingual Factual Reasoning through Adaptive Chain-of-Thought,"Xin Huang, Tarun Kumar Vangani, Zhengyuan Liu, Bowei Zou, Ai Ti Aw","Abstract:Large language models (LLMs) have shown impressive multilingual capabilities through pretraining on diverse corpora. While these models show strong reasoning abilities, their performance varies significantly across languages due to uneven training data distribution. Existing approaches using machine translation, and extensive multilingual pretraining and cross-lingual tuning face scalability challenges and often fail to capture nuanced reasoning processes across languages. In this paper, we introduce AdaCoT (Adaptive Chain-of-Thought), a framework that enhances multilingual reasoning by dynamically routing thought processes through intermediary ""thinking languages"" before generating target-language responses. AdaCoT leverages a language-agnostic core and incorporates an adaptive, reward-based mechanism for selecting optimal reasoning pathways without requiring additional pretraining. Our comprehensive evaluation across multiple benchmarks demonstrates substantial improvements in both factual reasoning quality and cross-lingual consistency, with particularly strong performance gains in low-resource language settings. The results suggest that adaptive reasoning paths can effectively bridge the performance gap between high and low-resource languages while maintaining cultural and linguistic nuances.",https://arxiv.org/abs/2501.16154,Computation and Language (cs.CL); Artificial Intelligence (cs.AI)
