title,authors,abstract,link,subjects
Enhancing Visual Inspection Capability of Multi-Modal Large Language Models on Medical Time Series with Supportive Conformalized and Interpretable Small Specialized Models,"Huayu Li, Xiwen Chen, Ci Zhang, Stuart F. Quan, William D.S. Killgore, Shu-Fen Wung, Chen X. Chen, Geng Yuan, Jin Lu, Ao Li","Abstract:Large language models (LLMs) exhibit remarkable capabilities in visual inspection of medical time-series data, achieving proficiency comparable to human clinicians. However, their broad scope limits domain-specific precision, and proprietary weights hinder fine-tuning for specialized datasets. In contrast, small specialized models (SSMs) excel in targeted tasks but lack the contextual reasoning required for complex clinical decision-making. To address these challenges, we propose ConMIL (Conformalized Multiple Instance Learning), a decision-support SSM that integrates seamlessly with LLMs. By using Multiple Instance Learning (MIL) to identify clinically significant signal segments and conformal prediction for calibrated set-valued outputs, ConMIL enhances LLMs' interpretative capabilities for medical time-series analysis. Experimental results demonstrate that ConMIL significantly improves the performance of state-of-the-art LLMs, such as ChatGPT4.0 and Qwen2-VL-7B. Specifically, \ConMIL{}-supported Qwen2-VL-7B achieves 94.92% and 96.82% precision for confident samples in arrhythmia detection and sleep staging, compared to standalone LLM accuracy of 46.13% and 13.16%. These findings highlight the potential of ConMIL to bridge task-specific precision and broader contextual reasoning, enabling more reliable and interpretable AI-driven clinical decision support.",https://arxiv.org/abs/2501.16215,Artificial Intelligence (cs.AI); Machine Learning (cs.LG); Signal Processing (eess.SP)
From Informal to Formal -- Incorporating and Evaluating LLMs on Natural Language Requirements to Verifiable Formal Proofs,"Jialun Cao, Yaojie Lu, Meiziniu Li, Haoyang Ma, Haokun Li, Mengda He, Cheng Wen, Le Sun, Hongyu Zhang, Shengchao Qin, Shing-Chi Cheung, Cong Tian","Abstract:The research in AI-based formal mathematical reasoning has shown an unstoppable growth trend. These studies have excelled in mathematical competitions like IMO, showing significant progress. However, these studies intertwined multiple skills simultaneously, i.e., problem-solving, reasoning, and writing formal specifications, making it hard to precisely identify the LLMs' strengths and weaknesses in each task. This paper focuses on formal verification, an immediate application scenario of formal reasoning, and decomposes it into six sub-tasks. We constructed 18k high-quality instruction-response pairs across five mainstream formal specification languages (Coq, Lean4, Dafny, ACSL, and TLA+) in six formal-verification-related tasks by distilling GPT-4o. They are split into a 14k+ fine-tuning dataset FM-alpaca and a 4k benchmark FM-Bench. We found that LLMs are good at writing proof segments when given either the code, or the detailed description of proof steps. Also, the fine-tuning brought about a nearly threefold improvement at most. Interestingly, we observed that fine-tuning with formal data also enhances mathematics, reasoning, and coding abilities. We hope our findings inspire further research. Fine-tuned models are released to facilitate subsequent studies",https://arxiv.org/abs/2501.16207,Artificial Intelligence (cs.AI)
"AI Agents for Computer Use: A Review of Instruction-based Computer Control, GUI Automation, and Operator Assistants","Pascal J. Sager, Benjamin Meyer, Peng Yan, Rebekka von Wartburg-Kottler, Layan Etaiwi, Aref Enayati, Gabriel Nobel, Ahmed Abdulkadir, Benjamin F. Grewe, Thilo Stadelmann","Abstract:Instruction-based computer control agents (CCAs) execute complex action sequences on personal computers or mobile devices to fulfill tasks using the same graphical user interfaces as a human user would, provided instructions in natural language. This review offers a comprehensive overview of the emerging field of instruction-based computer control, examining available agents -- their taxonomy, development, and respective resources -- and emphasizing the shift from manually designed, specialized agents to leveraging foundation models such as large language models (LLMs) and vision-language models (VLMs). We formalize the problem and establish a taxonomy of the field to analyze agents from three perspectives: (a) the environment perspective, analyzing computer environments; (b) the interaction perspective, describing observations spaces (e.g., screenshots, HTML) and action spaces (e.g., mouse and keyboard actions, executable code); and (c) the agent perspective, focusing on the core principle of how an agent acts and learns to act. Our framework encompasses both specialized and foundation agents, facilitating their comparative analysis and revealing how prior solutions in specialized agents, such as an environment learning step, can guide the development of more capable foundation agents. Additionally, we review current CCA datasets and CCA evaluation methods and outline the challenges to deploying such agents in a productive setting. In total, we review and classify 86 CCAs and 33 related datasets. By highlighting trends, limitations, and future research directions, this work presents a comprehensive foundation to obtain a broad understanding of the field and push its future development.",https://arxiv.org/abs/2501.16150,Artificial Intelligence (cs.AI); Human-Computer Interaction (cs.HC); Systems and Control (eess.SY)
Flexible Blood Glucose Control: Offline Reinforcement Learning from Human Feedback,"Harry Emerson, Sam Gordon James, Matthew Guy, Ryan McConville","Abstract:Reinforcement learning (RL) has demonstrated success in automating insulin dosing in simulated type 1 diabetes (T1D) patients but is currently unable to incorporate patient expertise and preference. This work introduces PAINT (Preference Adaptation for INsulin control in T1D), an original RL framework for learning flexible insulin dosing policies from patient records. PAINT employs a sketch-based approach for reward learning, where past data is annotated with a continuous reward signal to reflect patient's desired outcomes. Labelled data trains a reward model, informing the actions of a novel safety-constrained offline RL algorithm, designed to restrict actions to a safe strategy and enable preference tuning via a sliding scale. In-silico evaluation shows PAINT achieves common glucose goals through simple labelling of desired states, reducing glycaemic risk by 15% over a commercial benchmark. Action labelling can also be used to incorporate patient expertise, demonstrating an ability to pre-empt meals (+10% time-in-range post-meal) and address certain device errors (-1.6% variance post-error) with patient guidance. These results hold under realistic conditions, including limited samples, labelling errors, and intra-patient variability. This work illustrates PAINT's potential in real-world T1D management and more broadly any tasks requiring rapid and precise preference learning under safety constraints.",https://arxiv.org/abs/2501.15972,Artificial Intelligence (cs.AI); Machine Learning (cs.LG)
Are Transformers Able to Reason by Connecting Separated Knowledge in Training Data?,"Yutong Yin, Zhaoran Wang","Abstract:Humans exhibit remarkable compositional reasoning by integrating knowledge from various sources. For example, if someone learns ( B = f(A) ) from one source and ( C = g(B) ) from another, they can deduce ( C=g(B)=g(f(A)) ) even without encountering ( ABC ) together, showcasing the generalization ability of human intelligence. In this paper, we introduce a synthetic learning task, ""FTCT"" (Fragmented at Training, Chained at Testing), to validate the potential of Transformers in replicating this skill and interpret its inner mechanism. In the training phase, data consist of separated knowledge fragments from an overall causal graph. During testing, Transformers must infer complete causal graph traces by integrating these fragments. Our findings demonstrate that few-shot Chain-of-Thought prompting enables Transformers to perform compositional reasoning on FTCT by revealing correct combinations of fragments, even if such combinations were absent in the training data. Furthermore, the emergence of compositional reasoning ability is strongly correlated with the model complexity and training-testing data similarity. We propose, both theoretically and empirically, that Transformers learn an underlying generalizable program from training, enabling effective compositional reasoning during testing.",https://arxiv.org/abs/2501.15857,Artificial Intelligence (cs.AI); Computation and Language (cs.CL); Machine Learning (cs.LG)
Harnessing Diverse Perspectives: A Multi-Agent Framework for Enhanced Error Detection in Knowledge Graphs,"Yu Li, Yi Huang, Guilin Qi, Junlan Feng, Nan Hu, Songlin Zhai, Haohan Xue, Yongrui Chen, Ruoyan Shen, Tongtong Wu","Abstract:Knowledge graphs are widely used in industrial applications, making error detection crucial for ensuring the reliability of downstream applications. Existing error detection methods often fail to effectively leverage fine-grained subgraph information and rely solely on fixed graph structures, while also lacking transparency in their decision-making processes, which results in suboptimal detection performance. In this paper, we propose a novel Multi-Agent framework for Knowledge Graph Error Detection (MAKGED) that utilizes multiple large language models (LLMs) in a collaborative setting. By concatenating fine-grained, bidirectional subgraph embeddings with LLM-based query embeddings during training, our framework integrates these representations to produce four specialized agents. These agents utilize subgraph information from different dimensions to engage in multi-round discussions, thereby improving error detection accuracy and ensuring a transparent decision-making process. Extensive experiments on FB15K and WN18RR demonstrate that MAKGED outperforms state-of-the-art methods, enhancing the accuracy and robustness of KG evaluation. For specific industrial scenarios, our framework can facilitate the training of specialized agents using domain-specific knowledge graphs for error detection, which highlights the potential industrial application value of our framework. Our code and datasets are available at this https URL.",https://arxiv.org/abs/2501.15791,Artificial Intelligence (cs.AI); Multiagent Systems (cs.MA)
LLM-powered Multi-agent Framework for Goal-oriented Learning in Intelligent Tutoring System,"Tianfu Wang, Yi Zhan, Jianxun Lian, Zhengyu Hu, Nicholas Jing Yuan, Qi Zhang, Xing Xie, Hui Xiong","Abstract:Intelligent Tutoring Systems (ITSs) have revolutionized education by offering personalized learning experiences. However, as goal-oriented learning, which emphasizes efficiently achieving specific objectives, becomes increasingly important in professional contexts, existing ITSs often struggle to deliver this type of targeted learning experience. In this paper, we propose GenMentor, an LLM-powered multi-agent framework designed to deliver goal-oriented, personalized learning within ITS. GenMentor begins by accurately mapping learners' goals to required skills using a fine-tuned LLM trained on a custom goal-to-skill dataset. After identifying the skill gap, it schedules an efficient learning path using an evolving optimization approach, driven by a comprehensive and dynamic profile of learners' multifaceted status. Additionally, GenMentor tailors learning content with an exploration-drafting-integration mechanism to align with individual learner needs. Extensive automated and human evaluations demonstrate GenMentor's effectiveness in learning guidance and content quality. Furthermore, we have deployed it in practice and also implemented it as an application. Practical human study with professional learners further highlights its effectiveness in goal alignment and resource targeting, leading to enhanced personalization. Supplementary resources are available at this https URL.",https://arxiv.org/abs/2501.15749,Artificial Intelligence (cs.AI); Multiagent Systems (cs.MA)
Propositional Interpretability in Artificial Intelligence,David J. Chalmers,"Abstract:Mechanistic interpretability is the program of explaining what AI systems are doing in terms of their internal mechanisms. I analyze some aspects of the program, along with setting out some concrete challenges and assessing progress to date. I argue for the importance of propositional interpretability, which involves interpreting a system's mechanisms and behavior in terms of propositional attitudes: attitudes (such as belief, desire, or subjective probability) to propositions (e.g. the proposition that it is hot outside). Propositional attitudes are the central way that we interpret and explain human beings and they are likely to be central in AI too. A central challenge is what I call thought logging: creating systems that log all of the relevant propositional attitudes in an AI system over time. I examine currently popular methods of interpretability (such as probing, sparse auto-encoders, and chain of thought methods) as well as philosophical methods of interpretation (including those grounded in psychosemantics) to assess their strengths and weaknesses as methods of propositional interpretability.",https://arxiv.org/abs/2501.15740,Artificial Intelligence (cs.AI)
Rethinking External Slow-Thinking: From Snowball Errors to Probability of Correct Reasoning,"Zeyu Gan, Yun Liao, Yong Liu","Abstract:Test-time scaling, which is also often referred to as slow-thinking, has been demonstrated to enhance multi-step reasoning in large language models (LLMs). However, despite its widespread utilization, the mechanisms underlying slow-thinking methods remain poorly understood. This paper explores the mechanisms of external slow-thinking from a theoretical standpoint. We begin by examining the snowball error effect within the LLM reasoning process and connect it to the likelihood of correct reasoning using information theory. Building on this, we show that external slow-thinking methods can be interpreted as strategies to mitigate the error probability. We further provide a comparative analysis of popular external slow-thinking approaches, ranging from simple to complex, highlighting their differences and interrelationships. Our findings suggest that the efficacy of these methods is not primarily determined by the specific framework employed, and that expanding the search scope or the model's internal reasoning capacity may yield more sustained improvements in the long term. We open-source our code at this https URL.",https://arxiv.org/abs/2501.15602,Artificial Intelligence (cs.AI); Computation and Language (cs.CL)
Expert-Free Online Transfer Learning in Multi-Agent Reinforcement Learning,Alberto Castagna,"Abstract:Reinforcement Learning (RL) enables an intelligent agent to optimise its performance in a task by continuously taking action from an observed state and receiving a feedback from the environment in form of rewards. RL typically uses tables or linear approximators to map state-action tuples that maximises the reward. Combining RL with deep neural networks (DRL) significantly increases its scalability and enables it to address more complex problems than before. However, DRL also inherits downsides from both RL and deep learning. Despite DRL improves generalisation across similar state-action pairs when compared to simpler RL policy representations like tabular methods, it still requires the agent to adequately explore the state-action space. Additionally, deep methods require more training data, with the volume of data escalating with the complexity and size of the neural network. As a result, deep RL requires a long time to collect enough agent-environment samples and to successfully learn the underlying policy. Furthermore, often even a slight alteration to the task invalidates any previous acquired knowledge. To address these shortcomings, Transfer Learning (TL) has been introduced, which enables the use of external knowledge from other tasks or agents to enhance a learning process. The goal of TL is to reduce the learning complexity for an agent dealing with an unfamiliar task by simplifying the exploration process. This is achieved by lowering the amount of new information required by its learning model, resulting in a reduced overall convergence time...",https://arxiv.org/abs/2501.15495,Artificial Intelligence (cs.AI); Machine Learning (cs.LG); Multiagent Systems (cs.MA)
AI in Oncology: Transforming Cancer Detection through Machine Learning and Deep Learning Applications,"Muhammad Aftab, Faisal Mehmood, Chengjuan Zhang, Alishba Nadeem, Zigang Dong, Yanan Jiang, Kangdongs Liu","Abstract:Artificial intelligence (AI) has potential to revolutionize the field of oncology by enhancing the precision of cancer diagnosis, optimizing treatment strategies, and personalizing therapies for a variety of cancers. This review examines the limitations of conventional diagnostic techniques and explores the transformative role of AI in diagnosing and treating cancers such as lung, breast, colorectal, liver, stomach, esophageal, cervical, thyroid, prostate, and skin cancers. The primary objective of this paper is to highlight the significant advancements that AI algorithms have brought to oncology within the medical industry. By enabling early cancer detection, improving diagnostic accuracy, and facilitating targeted treatment delivery, AI contributes to substantial improvements in patient outcomes. The integration of AI in medical imaging, genomic analysis, and pathology enhances diagnostic precision and introduces a novel, less invasive approach to cancer screening. This not only boosts the effectiveness of medical facilities but also reduces operational costs. The study delves into the application of AI in radiomics for detailed cancer characterization, predictive analytics for identifying associated risks, and the development of algorithm-driven robots for immediate diagnosis. Furthermore, it investigates the impact of AI on addressing healthcare challenges, particularly in underserved and remote regions. The overarching goal of this platform is to support the development of expert recommendations and to provide universal, efficient diagnostic procedures. By reviewing existing research and clinical studies, this paper underscores the pivotal role of AI in improving the overall cancer care system. It emphasizes how AI-enabled systems can enhance clinical decision-making and expand treatment options, thereby underscoring the importance of AI in advancing precision oncology",https://arxiv.org/abs/2501.15489,Artificial Intelligence (cs.AI); Image and Video Processing (eess.IV); Quantitative Methods (q-bio.QM)
A Neurosymbolic Framework for Geometric Reduction of Binary Forms,"Ilias Kotsireas, Tony Shaska","Abstract:This paper compares Julia reduction and hyperbolic reduction with the aim of finding equivalent binary forms with minimal coefficients. We demonstrate that hyperbolic reduction generally outperforms Julia reduction, particularly in the cases of sextics and decimics, though neither method guarantees achieving the minimal form. We further propose an additional shift and scaling to approximate the minimal form more closely. Finally, we introduce a machine learning framework to identify optimal transformations that minimize the heights of binary forms. This study provides new insights into the geometry and algebra of binary forms and highlights the potential of AI in advancing symbolic computation and reduction techniques. The findings, supported by extensive computational experiments, lay the groundwork for hybrid approaches that integrate traditional reduction methods with data-driven techniques.",https://arxiv.org/abs/2501.15404,Artificial Intelligence (cs.AI); Machine Learning (cs.LG)
Diffusion-based Hierarchical Negative Sampling for Multimodal Knowledge Graph Completion,"Guanglin Niu, Xiaowei Zhang","Abstract:Multimodal Knowledge Graph Completion (MMKGC) aims to address the critical issue of missing knowledge in multimodal knowledge graphs (MMKGs) for their better applications. However, both the previous MMGKC and negative sampling (NS) approaches ignore the employment of multimodal information to generate diverse and high-quality negative triples from various semantic levels and hardness levels, thereby limiting the effectiveness of training MMKGC models. Thus, we propose a novel Diffusion-based Hierarchical Negative Sampling (DHNS) scheme tailored for MMKGC tasks, which tackles the challenge of generating high-quality negative triples by leveraging a Diffusion-based Hierarchical Embedding Generation (DiffHEG) that progressively conditions on entities and relations as well as multimodal semantics. Furthermore, we develop a Negative Triple-Adaptive Training (NTAT) strategy that dynamically adjusts training margins associated with the hardness level of the synthesized negative triples, facilitating a more robust and effective learning procedure to distinguish between positive and negative triples. Extensive experiments on three MMKGC benchmark datasets demonstrate that our framework outperforms several state-of-the-art MMKGC models and negative sampling techniques, illustrating the effectiveness of our DHNS for training MMKGC models. The source codes and datasets of this paper are available at this https URL.",https://arxiv.org/abs/2501.15393,Artificial Intelligence (cs.AI); Computation and Language (cs.CL)
How to Mitigate Information Loss in Knowledge Graphs for GraphRAG: Leveraging Triple Context Restoration and Query-Driven Feedback,"Manzong Huang, Chenyang Bu, Yi He, Xindong Wu","Abstract:Knowledge Graph (KG)-augmented Large Language Models (LLMs) have recently propelled significant advances in complex reasoning tasks, thanks to their broad domain knowledge and contextual awareness. Unfortunately, current methods often assume KGs to be complete, which is impractical given the inherent limitations of KG construction and the potential loss of contextual cues when converting unstructured text into entity-relation triples. In response, this paper proposes the Triple Context Restoration and Query-driven Feedback (TCR-QF) framework, which reconstructs the textual context underlying each triple to mitigate information loss, while dynamically refining the KG structure by iteratively incorporating query-relevant missing knowledge. Experiments on five benchmark question-answering datasets substantiate the effectiveness of TCR-QF in KG and LLM integration, where itachieves a 29.1% improvement in Exact Match and a 15.5% improvement in F1 over its state-of-the-art GraphRAG competitors.",https://arxiv.org/abs/2501.15378,Artificial Intelligence (cs.AI); Information Retrieval (cs.IR)
Who's Driving? Game Theoretic Path Risk of AGI Development,Robin Young,"Abstract:Who controls the development of Artificial General Intelligence (AGI) might matter less than how we handle the fight for control itself. We formalize this ""steering wheel problem"" as humanity's greatest near-term existential risk may stem not from misaligned AGI, but from the dynamics of competing to develop it. Just as a car crash can occur from passengers fighting over the wheel before reaching any destination, catastrophic outcomes could arise from development competition long before AGI exists. While technical alignment research focuses on ensuring safe arrival, we show how coordination failures during development could drive us off the cliff first.
We present a game theoretic framework modeling AGI development dynamics and prove conditions for sustainable cooperative equilibria. Drawing from nuclear control while accounting for AGI's unique characteristics, we propose concrete mechanisms including pre-registration, shared technical infrastructure, and automated deterrence to stabilize cooperation. Our key insight is that AGI creates network effects in safety: shared investments become more valuable as participation grows, enabling mechanism designs where cooperation dominates defection. This work bridges formal methodology and policy frameworks, providing foundations for practical governance of AGI competition risks.",https://arxiv.org/abs/2501.15280,Artificial Intelligence (cs.AI); Computers and Society (cs.CY); Computer Science and Game Theory (cs.GT)
